NYMA-TX1 Montefiore Medical Center,,327,29,4,2,1,0,0,4,0,9,0,0,3,2,5,0,1,3,2,2,4,44,5,4,3,0,2,4,2,3,2,33,1,0,7,1,44,3,5,4,3,0,2,49,10,2,5,3,0,1,1,4,4,2,1,0,2
NYMS-TX1 Mount Sinai Medical Center,,578,82,0,1,0,1,0,3,0,4,0,2,5,5,0,0,2,4,1,6,1,86,13,8,4,4,1,2,2,11,4,45,1,2,22,6,83,3,4,6,3,2,0,107,9,1,2,9,0,5,4,3,1,6,0,2,0
NYNS-TX1 North Shore University Hospital/Northwell Health,,426,53,1,0,0,3,1,5,0,4,0,1,3,3,6,1,0,3,0,2,2,56,15,4,3,1,0,3,5,2,0,25,0,1,17,3,80,3,4,6,1,0,1,61,13,2,4,5,2,1,1,2,0,10,5,0,2
NYNY-TX1 New York-Presbyterian Hospital/Weill Cornell Medical Center,,355,104,0,0,1,2,0,2,0,2,0,0,1,1,0,0,0,4,0,1,0,40,3,2,6,4,0,3,1,2,0,29,0,0,9,3,61,0,2,2,4,0,0,55,3,0,4,1,0,0,0,0,1,2,0,0,0
NYSB-TX1 University Hospital of State University of New York at Stony Brook,,61,14,0,0,0,0,0,0,0,0,0,0,0,0,0,0,0,0,0,0,0,12,0,0,1,0,0,0,0,0,1,3,0,0,1,3,22,0,0,0,0,0,0,2,0,0,0,1,0,0,0,1,0,0,0,0,0
NYUC-TX1 NYU Langone Health,,586,83,2,2,8,4,0,4,4,14,1,4,2,1,6,1,7,12,5,7,7,52,12,20,5,18,1,7,3,16,4,25,1,1,19,7,89,5,8,5,5,4,0,45,17,2,8,2,0,12,0,3,1,8,1,3,3
NYUM-TX1 State University of New York Upstate Medical University,,67,12,0,0,0,0,0,0,0,0,0,0,0,1,1,0,0,1,1,0,0,9,0,0,0,0,0,0,1,0,0,2,1,0,2,10,7,4,1,0,0,0,0,6,6,0,0,1,0,0,1,0,0,0,0,0,0
NYVA-TX1 James J. Peters VA Medical Center,,16,2,0,0,0,0,0,0,0,0,0,0,0,0,0,0,0,0,0,0,0,3,0,0,0,0,0,0,0,0,0,2,0,0,2,0,3,1,0,0,0,0,0,3,0,0,0,0,0,0,0,0,0,0,0,0,0
NYWC-TX1 Westchester Medical Center,,183,15,0,0,0,0,0,0,0,1,2,1,0,0,0,0,0,0,0,0,1,37,5,0,0,0,0,0,2,4,0,19,0,0,10,3,37,5,3,2,1,0,1,21,8,0,0,1,0,0,0,0,0,4,0,0,0
OHCC-TX1 The Cleveland Clinic Foundation,,902,99,10,4,3,1,0,2,0,4,2,4,3,4,12,0,5,23,56,22,6,15,7,56,12,8,0,29,8,11,5,12,6,3,8,2,25,12,143,29,48,5,1,50,46,2,13,30,0,11,2,3,3,12,1,8,16
OHCH-TX1 Nationwide Children's Hospital,,38,4,0,0,0,0,0,0,0,0,0,0,0,0,4,0,0,1,2,5,0,1,1,2,0,2,0,0,1,1,0,0,0,0,0,0,1,0,1,1,3,0,0,1,2,0,0,3,2,0,0,0,0,0,0,0,0
OHCM-TX1 Children's Hospital Medical Center,,71,14,4,0,0,0,1,0,0,3,0,0,0,0,1,0,0,5,6,4,0,0,0,3,0,0,0,2,1,0,0,1,0,0,0,1,0,0,4,1,0,2,0,1,3,0,5,5,0,0,0,1,0,1,0,1,1
OHCO-TX1 University of Toledo Medical Center,,195,6,3,0,4,6,4,4,2,3,1,0,0,0,4,2,2,14,8,6,1,4,0,25,3,0,0,7,2,2,0,0,4,2,2,0,2,1,6,15,5,0,2,3,8,1,3,2,0,2,3,6,0,1,9,4,1
OHOU-TX1 Ohio State University Medical Center,,617,87,6,4,1,1,0,1,0,0,4,1,2,1,8,0,1,25,79,54,3,4,4,36,4,9,1,6,5,4,1,4,0,0,1,0,8,0,31,49,51,2,0,14,53,1,2,18,4,4,1,7,1,5,1,3,5
OHTC-TX1 The Christ Hospital,,78,25,0,0,0,0,0,0,0,0,0,1,0,0,0,0,0,4,6,9,0,1,1,4,0,2,1,0,0,1,0,0,0,0,0,0,0,0,1,4,5,0,0,0,8,0,0,4,0,0,0,0,0,1,0,0,0
OHUC-TX1 University of Cincinnati  Medical Center,,287,28,2,0,8,0,0,0,0,0,1,0,1,1,3,0,1,12,29,65,0,0,2,14,0,1,1,12,3,1,0,1,0,0,0,0,2,0,8,24,13,1,1,11,11,0,0,18,3,0,0,0,0,1,4,1,3
OHUH-TX1 University Hospitals of Cleveland,,284,19,0,1,6,0,0,0,0,0,1,0,0,0,3,0,0,5,21,15,0,3,2,32,5,3,1,0,0,1,1,2,0,0,0,1,5,13,54,5,15,0,0,3,50,1,1,3,0,0,0,1,1,3,5,0,2
OKBC-TX1 Integris Baptist Medical Center,,224,23,1,3,1,0,0,3,1,9,0,0,0,0,1,0,0,3,0,0,1,0,1,0,3,3,0,35,0,0,2,0,2,0,2,0,0,0,0,0,0,77,0,0,1,0,0,0,3,25,5,18,0,0,0,0,1
OKCM-TX1 Children's Hospital of Oklahoma,,2,0,0,0,0,0,0,0,0,0,0,0,0,0,0,0,0,0,0,0,0,0,0,0,0,0,0,1,0,0,0,0,0,0,0,0,0,0,0,0,0,1,0,0,0,0,0,0,0,0,0,0,0,0,0,0,0
OKMD-TX1 OU Medical Center,,77,6,1,4,0,0,0,0,0,1,0,0,0,0,0,0,0,0,0,0,0,1,0,0,0,3,2,16,0,0,0,0,0,0,0,0,0,0,0,0,0,22,0,0,1,0,0,1,0,13,0,6,0,0,0,0,0
OKSJ-TX1 St John Medical Center,,49,15,0,0,0,0,0,0,0,0,0,0,0,0,1,0,0,0,1,0,0,0,0,0,0,0,0,17,0,0,0,0,0,0,0,0,0,0,0,0,0,11,1,0,0,0,0,0,0,2,0,1,0,0,0,0,0
ORGS-TX1 Legacy Good Samaritan Hospital and Medical Center,,96,22,0,0,0,0,0,0,0,0,0,0,0,0,0,0,0,0,0,1,0,0,1,1,0,0,0,0,0,0,0,0,0,0,0,0,0,0,0,0,0,0,37,0,0,1,0,0,0,0,0,0,2,0,31,0,0
ORSV-TX1 Providence St. Vincent Medical Center,,13,0,0,0,1,1,0,1,1,0,0,0,0,0,0,0,0,0,0,0,0,0,0,0,0,0,0,0,0,0,0,0,0,0,0,0,0,0,0,0,0,0,6,0,0,0,0,0,0,0,0,0,0,0,3,0,0
ORUO-TX1 Oregon Health and Science University,,242,28,0,0,1,8,1,1,0,2,0,0,0,0,0,1,0,0,0,0,0,0,0,1,1,0,0,0,0,0,0,0,2,0,0,0,0,0,0,0,0,0,85,0,2,0,0,1,1,0,0,0,2,0,105,0,0
ORVA-TX1 VA Portland Health Care System,,65,0,0,0,0,2,0,1,0,0,0,0,0,0,0,0,0,0,0,0,0,0,0,0,0,0,0,0,0,0,0,0,0,0,0,0,0,0,0,0,0,0,27,0,0,0,0,0,0,0,0,0,2,0,32,0,1
PAAE-TX1 Albert Einstein Medical Center,,137,4,0,1,0,0,0,0,0,0,0,1,0,1,0,0,1,0,1,1,0,6,8,1,0,0,0,0,2,4,0,9,0,1,5,2,11,1,2,1,1,0,0,55,9,0,2,2,0,0,0,1,0,4,0,0,0
PAAG-TX1 Allegheny General Hospital,,177,22,0,0,0,0,1,2,1,0,0,0,0,1,1,0,0,3,7,1,0,3,4,4,1,0,0,0,1,1,0,2,0,0,2,0,2,1,7,4,5,0,0,6,85,0,0,6,0,1,0,0,1,1,1,0,0
PACH-TX1 UPMC Children's Hospital of Pittsburgh,,69,18,0,0,0,0,0,0,0,1,0,0,0,1,1,0,0,2,5,4,1,0,2,3,0,1,1,0,1,2,0,0,0,0,0,2,3,0,0,0,3,0,0,2,10,0,2,1,0,0,0,0,0,2,0,0,1
PACP-TX1 Children's Hospital of Philadelphia,,50,13,0,0,0,0,0,0,0,0,0,0,0,0,1,0,0,1,0,0,0,3,2,0,0,0,1,1,2,0,0,3,0,0,1,3,2,1,0,0,1,0,0,10,1,1,0,0,0,0,0,0,0,3,0,0,0
PAGM-TX1 Geisinger Medical Center,,97,20,0,0,1,0,0,0,0,0,0,0,0,0,0,0,0,0,0,3,0,6,6,1,0,0,0,0,0,0,0,3,0,0,3,7,5,0,3,0,0,0,0,26,7,0,1,0,0,0,0,0,0,4,1,0,0
PAHE-TX1 Penn State Milton S Hershey Medical Center,,13,0,0,0,0,0,0,0,0,0,0,0,0,0,0,0,0,0,1,1,0,1,0,0,0,0,0,0,0,0,0,1,0,0,2,0,0,0,0,0,0,0,0,3,2,0,1,0,0,0,0,0,0,1,0,0,0
PAHH-TX1 Pinnacle Health System at Harrisburg Hospital,,84,44,0,0,0,0,0,0,0,0,0,0,0,0,1,0,0,0,0,0,0,1,0,0,1,0,0,0,0,0,0,2,0,1,1,1,3,1,2,0,0,1,1,14,5,0,0,0,0,0,0,0,0,3,1,0,1
PALV-TX1 Lehigh Valley Hospital,,167,34,2,0,0,0,0,1,0,0,2,1,1,0,1,0,0,0,1,1,0,9,11,1,2,0,0,1,0,0,0,4,0,0,6,2,23,4,4,3,1,1,0,33,8,0,0,1,0,0,0,1,0,6,0,0,2
PAPH-TX1 UPMC Hamot,,11,5,0,0,0,0,0,0,0,0,0,0,0,0,0,0,0,0,0,0,0,0,0,0,0,0,0,0,0,0,0,0,0,0,0,0,0,1,2,1,0,0,0,0,2,0,0,0,0,0,0,0,0,0,0,0,0
PAPT-TX1 University of Pittsburgh Medical Center,,414,166,2,0,0,0,0,0,0,3,0,3,3,2,8,0,1,4,7,7,4,5,8,8,2,2,1,1,1,2,1,2,0,0,1,1,1,4,23,6,12,3,0,21,77,2,2,5,0,0,0,2,0,6,1,1,3
PASC-TX1 St. Christopher's Hospital for Children,,2,1,0,0,0,0,0,0,0,0,0,0,0,0,0,0,0,0,0,0,0,0,0,0,0,0,0,0,0,0,0,0,0,0,0,0,0,0,0,0,0,0,0,0,1,0,0,0,0,0,0,0,0,0,0,0,0
PATJ-TX1 Thomas Jefferson University Hospital,,211,27,0,0,0,0,0,0,0,0,0,1,0,0,2,0,2,2,1,1,0,18,4,2,1,0,2,2,2,2,0,12,0,0,5,2,19,6,3,4,3,0,0,58,11,1,5,2,0,0,0,1,0,7,1,1,1
PATU-TX1 Temple University Hospital,,252,22,0,1,1,0,0,2,1,1,3,12,3,8,4,0,1,8,8,3,8,12,10,2,4,4,2,9,5,2,1,7,0,6,1,0,6,3,2,1,1,2,4,35,8,1,6,1,2,5,1,11,1,9,1,0,1
PAUP-TX1 Hospital of the University of Pennsylvania,,631,108,1,0,2,1,0,0,0,1,1,2,0,2,5,0,0,4,5,5,0,44,38,6,1,3,0,1,9,3,0,45,0,0,15,6,46,9,6,5,5,0,0,193,23,0,9,5,0,2,1,2,0,13,3,1,0
PAVA-TX1 VA Pittsburgh Healthcare System,,59,8,0,0,1,0,0,0,0,0,0,0,0,0,0,0,0,2,2,2,0,0,1,2,0,0,0,0,0,0,0,0,0,0,0,3,0,0,6,1,2,0,0,1,24,0,1,0,0,0,0,1,0,1,0,0,1
PRCC-TX1 Cardiovascular Center of Puerto Rico and the Caribbean,,2,0,0,0,0,0,0,0,0,0,0,0,0,0,0,0,0,0,0,0,0,0,0,0,0,0,0,0,0,0,0,0,0,0,0,0,0,0,0,0,0,0,0,0,0,2,0,0,0,0,0,0,0,0,0,0,0
PRSJ-TX1 Auxilio Mutuo Hospital,,101,7,0,0,1,0,0,0,0,0,0,2,0,0,0,0,0,0,0,0,0,0,0,0,0,0,0,0,0,0,0,0,0,0,0,0,0,0,0,0,0,0,0,0,0,89,0,1,0,0,0,0,0,1,0,0,0
RIRH-TX1 Rhode Island Hospital,,49,19,0,0,0,0,0,0,0,0,0,0,0,0,0,0,0,0,0,0,0,21,0,0,0,1,0,0,0,0,0,2,0,0,1,0,3,0,0,0,0,0,0,1,0,0,0,0,0,1,0,0,0,0,0,0,0
SCCH-TX1 MUSC Children's Hospital,,14,1,0,0,0,0,0,0,0,0,0,2,2,0,0,0,0,0,0,1,0,0,1,0,0,0,0,0,0,3,0,0,0,0,0,0,0,0,0,0,0,0,0,3,0,0,0,1,0,0,0,0,0,0,0,0,0
SCLA-TX1 MUSC Lancaster,,117,0,1,2,1,0,0,0,0,1,0,0,5,1,23,0,1,0,0,2,0,0,0,0,0,0,0,0,16,24,0,0,0,0,0,0,0,0,1,0,0,0,0,0,0,0,21,15,0,0,0,0,0,3,0,0,0
SCMU-TX1 Medical University of South Carolina,,677,65,7,0,0,1,1,1,0,2,12,11,46,15,106,0,0,1,3,6,4,6,10,2,1,5,3,2,38,75,2,0,0,1,1,0,1,0,1,1,5,2,2,8,7,3,184,13,1,9,3,4,0,5,0,1,0
SCPG-TX1 Prisma Health Greenville Memorial Hospital,,142,13,6,0,0,0,0,0,0,0,0,0,0,0,27,0,0,0,0,5,0,1,0,1,1,0,0,0,12,6,2,1,0,0,0,0,0,0,0,0,0,0,0,1,2,1,26,30,1,2,0,0,0,3,0,1,0
SDMK-TX1 Avera McKennan Hospital,,25,6,0,1,0,0,0,0,0,0,0,0,0,0,0,0,1,0,0,0,0,0,0,0,10,0,0,1,0,0,5,0,0,0,0,0,0,0,0,0,0,0,0,0,0,0,0,0,0,0,0,0,0,0,1,0,0
SDSV-TX1 Sanford Health/USD Medical Center,,25,6,0,0,0,0,0,0,0,1,0,0,0,0,0,0,2,0,0,0,0,0,0,0,11,0,0,0,0,0,4,0,0,0,0,0,0,0,0,0,0,0,0,0,0,0,0,0,0,0,0,1,0,0,0,0,0
TNBM-TX1 Baptist Memorial Hospital,,9,0,0,0,0,0,0,0,0,0,0,0,0,0,2,0,0,1,0,0,0,0,0,0,0,0,0,2,0,0,0,0,0,0,0,0,0,0,0,0,0,0,0,0,0,0,0,0,2,0,0,2,0,0,0,0,0
TNEM-TX1 Erlanger Medical Center,,29,3,4,0,0,0,0,0,0,0,0,0,1,0,8,0,0,0,1,3,0,0,0,1,0,1,0,0,0,0,0,0,0,0,0,0,0,0,0,0,0,0,0,0,0,0,1,6,0,0,0,0,0,0,0,0,0
TNLB-TX1 Le Bonheur Children's Medical Center,,18,2,0,0,0,0,0,0,0,0,0,0,0,0,0,0,0,0,1,1,1,0,0,0,0,0,3,0,0,0,0,0,0,0,0,0,0,1,0,0,0,1,0,0,0,0,0,5,1,0,0,2,0,0,0,0,0
TNMH-TX1 Methodist University Hospital,,227,17,10,30,0,2,0,2,0,1,0,0,2,0,3,0,0,3,6,3,4,2,1,0,0,34,7,4,1,0,1,0,0,0,0,0,0,0,0,0,2,1,1,0,3,1,3,34,43,3,1,2,0,0,0,0,0
TNST-TX1 Saint Thomas Hospital,,201,16,12,1,0,0,1,0,0,6,1,0,4,0,17,0,1,4,12,25,6,0,1,3,2,8,0,3,1,3,0,0,0,0,0,0,0,0,2,4,1,0,0,0,1,1,2,49,6,1,3,1,0,0,2,1,0
TNUK-TX1 University of Tennessee Medical Center at Knoxville,,73,19,0,0,2,0,0,0,0,1,1,0,0,0,3,0,0,2,1,6,0,0,0,0,3,0,0,0,2,2,0,0,0,0,0,0,1,0,0,1,2,0,1,0,0,0,1,25,0,0,0,0,0,0,0,0,0
TNVU-TX1 Vanderbilt University Medical Center,,960,67,37,18,6,3,3,6,2,16,3,2,12,8,42,0,8,39,72,56,22,8,4,13,3,58,8,11,10,16,1,4,5,5,2,1,4,4,1,13,6,15,4,12,14,0,11,208,18,10,9,12,7,7,13,7,14
TXAS-TX1 Baylor  Scott and White All Saints Medical Center-Fort Worth,,132,18,1,2,0,0,0,0,0,0,0,0,0,0,0,0,0,0,0,0,2,0,0,0,0,0,0,1,0,0,0,0,5,0,0,0,0,0,0,0,0,27,0,0,0,0,0,0,0,33,12,31,0,0,0,0,0
"TXBC-TX1 University Hospital, University of Texas Health Science Center",,408,120,2,3,2,7,0,2,1,5,2,2,0,4,3,2,0,0,2,1,6,1,0,0,3,0,2,6,0,0,0,0,1,2,0,0,1,0,0,1,0,9,2,2,1,1,0,2,1,41,99,61,2,0,5,1,0
TXCF-TX1 Cook Children's Medical Center,,6,0,0,0,0,0,0,0,0,0,0,0,0,0,0,0,0,0,0,0,0,0,0,0,0,0,0,0,0,0,0,0,0,0,0,0,0,0,0,0,0,1,0,0,0,0,0,0,0,2,1,2,0,0,0,0,0
TXCM-TX1 Children's Medical Center of Dallas,,60,4,0,6,1,0,1,1,0,0,0,0,0,0,0,0,0,1,0,1,5,0,0,0,0,0,0,5,0,1,0,0,0,0,0,0,0,0,0,1,0,6,0,0,0,0,0,0,1,8,7,10,0,0,1,0,0
TXCT-TX1 Seton Medical Center Austin,,7,0,0,0,0,0,0,0,0,0,0,0,0,0,0,0,0,0,0,0,1,0,0,0,0,0,3,0,0,0,0,0,0,0,0,0,0,0,0,0,0,1,0,0,0,0,0,0,0,2,0,0,0,0,0,0,0
TXDC-TX1 Driscoll Children's Hospital,,6,0,0,0,0,0,0,0,0,0,0,0,0,0,0,0,0,0,0,0,0,0,0,0,0,0,0,0,0,0,0,0,0,0,0,0,0,0,0,0,0,0,0,0,0,0,0,0,0,1,4,1,0,0,0,0,0
TXDL-TX1 Dell Children's Medical Center,,10,0,0,0,0,0,0,0,0,0,0,0,0,1,0,0,0,0,0,0,0,0,0,0,0,0,1,0,0,0,0,0,0,0,0,0,0,0,0,0,0,0,0,0,0,0,0,0,2,2,2,1,1,0,0,0,0
TXDM-TX1 North Austin Medical Center,,34,18,0,0,0,0,0,0,0,0,0,0,0,0,0,0,0,0,0,0,0,1,0,0,0,0,0,0,0,0,0,0,0,0,0,0,0,0,0,1,0,0,0,0,0,0,0,0,0,4,4,6,0,0,0,0,0
TXDR-TX1 Doctor's Hospital at Renaissance,,101,11,0,1,0,3,0,2,0,1,1,0,0,0,0,0,1,0,2,0,2,0,0,0,2,0,0,3,0,1,2,0,0,0,0,0,1,0,0,0,0,2,0,2,0,0,0,1,0,4,31,25,1,0,2,0,0
TXDS-TX1 Dell Seton Medical Center at The University of Texas at Austin,,30,23,0,0,0,0,0,0,0,0,0,0,1,0,0,0,0,0,0,1,0,0,0,0,0,0,0,0,0,0,0,0,0,0,0,0,0,0,0,0,0,0,0,0,0,0,0,0,0,1,2,2,0,0,0,0,0
TXFW-TX1 Texas Health Harris Methodist Fort Worth Hospital,,71,22,0,1,0,0,0,0,0,0,0,1,0,0,0,0,0,0,0,0,0,0,0,0,0,0,0,0,0,0,0,0,0,0,0,0,0,0,0,1,0,9,0,0,0,0,0,0,0,27,4,6,0,0,0,0,0
TXHD-TX1 Medical City Dallas Hospital,,303,85,0,25,0,0,0,0,0,2,0,0,0,0,1,0,3,2,2,1,10,0,0,2,0,0,6,5,0,0,1,0,0,0,1,0,0,0,0,3,0,36,1,0,0,0,0,0,0,41,14,59,0,0,2,0,1
"TXHH-TX1 Memorial Hermann Hospital, University of Texas at Houston",,52,0,2,1,1,0,0,0,0,0,1,0,0,1,0,0,0,1,0,0,11,0,0,0,0,0,1,2,0,0,0,0,0,1,0,0,0,0,0,0,0,4,0,0,0,0,0,0,0,10,6,10,0,0,0,0,0
TXHI-TX1 CHI St. Luke's Health Baylor College of Medicine Medical Center,,406,32,11,3,3,6,2,5,1,9,1,3,9,0,3,0,1,6,7,2,44,2,2,1,0,2,6,6,0,2,2,2,0,3,1,0,1,0,0,0,0,9,1,4,0,0,1,0,7,105,34,62,2,0,3,0,0
TXHS-TX1 Methodist Specialty and Transplant Hospital,,489,168,0,3,5,0,1,2,0,4,1,0,1,1,1,0,0,1,1,0,8,3,1,0,0,1,2,10,1,1,0,1,1,1,0,0,2,0,0,0,0,9,2,2,3,0,0,1,0,49,116,81,2,0,3,0,0
TXJS-TX1 University of Texas Medical Branch at Galveston,,94,28,0,0,0,0,0,0,0,0,0,0,0,1,0,0,0,0,0,0,19,0,0,1,1,0,0,0,0,0,0,1,0,0,0,0,0,0,0,1,0,1,1,0,0,0,0,0,0,20,11,8,0,0,1,0,0
TXLM-TX1 Covenant Medical Center,,9,0,0,0,0,0,0,0,0,0,0,0,0,0,0,0,0,0,0,0,0,0,0,0,0,0,0,0,0,0,0,0,0,0,0,0,0,0,0,0,0,1,0,0,0,0,0,0,0,7,0,1,0,0,0,0,0
TXLP-TX1 Las Palmas Medical Center,,52,11,0,0,3,0,0,0,0,1,0,0,0,0,0,0,0,1,0,0,0,0,0,0,0,0,0,0,0,0,0,0,12,0,0,0,0,0,0,0,0,0,0,0,0,0,0,0,0,0,0,23,0,0,1,0,0
TXMC-TX1 Methodist Dallas Medical Center,,224,22,0,3,1,1,0,0,0,1,0,0,0,0,1,0,0,1,1,0,8,1,1,0,0,3,3,3,0,0,0,1,0,0,0,0,1,0,0,0,0,32,0,0,1,0,0,2,1,42,17,76,0,0,1,0,0
TXMH-TX1 Houston Methodist Hospital,,838,149,18,20,7,4,1,5,1,7,1,3,11,8,1,0,1,3,4,1,75,4,0,3,3,5,13,10,2,4,2,2,7,3,1,0,0,1,2,1,0,23,0,2,7,6,1,8,5,194,75,124,1,2,6,1,0
TXPL-TX1 Medical City Fort Worth,,100,15,0,0,0,1,0,0,0,0,0,0,0,0,1,0,0,0,0,0,2,1,0,0,0,0,0,0,0,0,1,0,0,0,0,0,0,0,0,0,0,16,0,0,0,0,0,0,0,38,2,20,0,1,2,0,0
TXPM-TX1 Parkland Health and Hospital System,,34,1,0,1,0,0,0,0,0,0,0,0,0,0,0,0,0,0,0,0,2,0,0,0,0,0,0,0,0,0,0,0,0,0,0,0,0,1,0,0,0,16,0,0,0,0,0,0,0,1,1,11,0,0,0,0,0
TXSP-TX1 UT Southwestern Medical Center/William P. Clements Jr. University Hospital,,458,49,5,13,3,1,1,2,0,2,3,1,1,1,2,0,0,3,1,2,14,4,1,1,0,3,1,15,0,1,4,1,1,3,0,0,1,0,0,0,0,43,4,2,0,0,0,3,2,105,24,125,1,0,5,3,1
TXSW-TX1 Scott and White Memorial Hospital,,101,16,0,1,0,1,0,0,0,1,0,0,0,1,0,0,0,0,1,0,1,0,0,0,3,1,0,2,0,0,1,0,4,0,0,0,0,0,0,0,0,5,0,0,0,0,0,0,1,13,18,31,0,0,0,0,0
TXTC-TX1 Texas Children's Hospital,,144,11,2,3,0,2,0,1,0,0,0,0,3,1,1,0,0,0,0,1,17,0,0,1,0,1,3,1,1,2,0,1,0,2,0,1,0,0,2,0,0,7,0,1,1,0,0,1,1,29,19,26,1,0,1,0,0
TXTX-TX1 Baylor University Medical Center,,533,133,3,13,16,4,3,6,1,5,1,3,0,2,4,0,0,3,3,2,12,0,1,3,6,2,2,5,3,0,1,1,1,4,0,0,1,1,0,0,1,48,0,2,0,0,1,4,1,71,24,131,2,0,2,0,1
TXUC-TX1 University Children's Health,,20,6,0,0,0,0,0,0,0,0,0,0,0,0,0,0,0,0,1,0,0,0,0,0,0,0,0,0,0,0,0,0,0,0,0,0,0,0,0,0,0,0,0,0,0,0,0,0,0,5,3,5,0,0,0,0,0
TXVA-TX1 Michael E. DeBakey VA Medical Center,,52,3,0,0,0,0,0,0,0,1,0,0,0,0,0,0,0,0,0,0,5,0,0,0,0,0,3,0,0,0,0,0,1,0,0,0,1,0,0,0,0,0,0,0,0,0,0,0,2,11,8,16,0,1,0,0,0
UTLD-TX1 Intermountain Medical Center,,515,77,0,0,25,16,14,13,1,34,0,0,0,0,0,7,3,1,3,1,0,1,0,0,2,0,1,7,0,0,0,1,11,31,1,0,0,0,0,0,0,0,19,0,0,0,0,0,0,1,0,2,202,0,40,0,1
UTMC-TX1 University of Utah Medical Center,,316,59,0,0,15,10,1,11,1,18,0,0,0,0,0,1,0,2,0,0,1,0,0,4,2,0,0,5,0,0,0,0,5,9,0,1,0,0,0,1,0,1,9,0,1,0,0,1,0,2,1,4,134,0,16,0,1
UTPC-TX1 Primary Children's Hospital,,51,13,0,0,1,0,3,2,2,3,0,1,0,0,1,0,0,0,0,0,0,0,0,0,0,0,0,0,0,0,0,0,1,9,0,0,0,0,0,0,0,0,3,0,0,0,0,0,0,0,1,0,11,0,0,0,0
VACH-TX1 Children's Hospital of the King's Daughters,,3,2,0,0,0,0,0,0,0,0,0,0,0,0,0,0,0,0,0,0,0,0,0,0,0,0,0,0,0,1,0,0,0,0,0,0,0,0,0,0,0,0,0,0,0,0,0,0,0,0,0,0,0,0,0,0,0
VAFH-TX1 Inova Fairfax Hospital,,286,44,3,0,1,0,0,3,0,0,2,4,1,1,11,0,3,5,3,5,0,9,23,3,1,0,3,2,2,5,1,15,0,0,3,0,25,2,3,1,0,0,0,54,18,0,6,6,0,1,1,3,0,12,0,1,0
VAHD-TX1 Henrico Doctors' Hospital,,37,14,0,0,0,0,0,0,0,0,0,0,0,0,0,0,0,0,0,0,0,0,0,0,0,1,0,0,1,1,0,1,0,0,0,0,0,0,0,0,0,0,0,4,3,0,1,0,0,0,1,0,0,10,0,0,0
"VAMC-TX1 VCU Health System Authority, VCUMC",,556,66,5,5,0,0,0,0,0,3,2,1,3,1,15,0,0,2,12,12,3,8,44,5,1,0,0,4,27,58,0,15,4,1,9,1,10,2,7,4,6,1,0,42,36,1,17,16,1,3,1,0,1,99,0,0,2
VANG-TX1 Sentara Norfolk General Hospital,,117,24,0,0,0,0,0,0,0,0,0,0,1,2,3,0,0,0,2,1,1,2,9,1,0,0,1,2,9,18,0,2,0,0,0,0,0,2,0,2,0,0,0,8,0,0,1,2,0,1,0,0,0,23,0,0,0
VAUV-TX1 University of Virginia Health Sciences Center,,370,37,4,1,0,0,1,0,0,0,1,0,6,1,12,0,1,6,6,9,2,5,19,1,2,0,0,3,16,26,0,8,1,0,1,2,4,2,12,2,17,0,0,32,35,2,12,7,1,2,1,5,0,63,0,1,1
VTMC-TX1 The University of Vermont Medical Center,,2,2,0,0,0,0,0,0,0,0,0,0,0,0,0,0,0,0,0,0,0,0,0,0,0,0,0,0,0,0,0,0,0,0,0,0,0,0,0,0,0,0,0,0,0,0,0,0,0,0,0,0,0,0,0,0,0
WACH-TX1 Seattle Children's Hospital,,52,10,0,0,0,0,0,0,0,1,0,0,0,0,0,0,0,0,0,0,0,0,0,0,0,0,0,0,0,0,0,0,0,0,0,0,0,0,0,0,0,0,16,0,0,0,0,0,0,0,0,0,3,0,22,0,0
WASH-TX1 Providence Sacred Heart Medical Center & Children's Hospital,,91,1,0,0,0,0,0,0,0,0,0,1,0,0,0,0,0,0,0,0,0,0,0,0,0,0,0,0,1,0,0,0,0,0,0,0,0,0,0,0,0,0,40,0,0,0,0,0,0,0,0,0,1,0,47,0,0
WASM-TX1 Swedish Medical Center,,235,19,1,0,0,0,0,1,0,1,1,0,0,0,0,0,0,0,0,0,0,0,0,0,0,0,0,0,0,0,0,0,0,0,0,0,0,0,0,0,0,0,35,1,0,0,0,0,0,0,0,0,2,0,174,0,0
WAUW-TX1 University of Washington Medical Center,,443,48,0,0,2,8,6,10,5,1,0,0,0,0,0,1,0,1,0,0,0,1,0,0,0,0,0,0,0,0,0,1,2,10,0,0,0,0,0,0,0,0,73,0,1,0,0,0,0,1,0,0,2,0,270,0,0
WAVM-TX1 Virginia Mason Medical Center,,101,23,0,0,0,0,0,0,1,0,0,0,0,0,0,0,0,0,0,0,1,0,0,0,0,0,0,1,1,0,0,0,0,0,0,0,0,0,0,0,0,0,16,0,0,0,0,0,0,1,0,0,0,0,57,0,0
WICH-TX1 Children's Hospital of Wisconsin,,18,1,0,0,0,0,0,0,0,0,0,0,0,0,0,0,1,2,4,2,0,0,0,0,0,0,0,0,0,0,2,0,0,0,0,0,0,0,0,1,1,0,0,0,1,0,0,0,0,0,0,0,1,0,0,0,2
WISE-TX1 Froedtert Memorial Lutheran Hospital,,299,73,0,0,0,1,0,0,0,2,1,0,0,2,1,0,3,39,14,4,0,2,0,29,14,3,0,6,2,1,4,1,1,0,0,1,0,0,1,5,2,1,0,2,1,0,1,12,0,3,0,3,0,2,3,35,24
WISL-TX1 Aurora St. Luke's Medical Center,,106,24,0,0,0,0,0,0,0,1,1,0,0,1,0,0,7,20,6,1,1,0,0,7,4,0,0,2,0,0,0,1,1,0,0,0,0,0,0,0,0,0,0,1,0,0,0,1,0,0,1,0,0,0,0,11,15
WIUW-TX1 University of Wisconsin Hospital and Clinics,,539,101,1,3,2,1,0,1,4,6,1,3,0,2,7,0,34,58,32,5,3,2,0,15,60,8,1,12,2,0,3,1,0,2,0,1,2,0,3,4,5,1,1,4,4,0,1,4,3,7,1,2,1,3,2,34,86
WVCA-TX1 Charleston Area Medical Center,,82,3,0,1,0,0,0,0,0,1,0,0,0,0,0,0,0,0,7,11,0,0,1,4,1,0,0,0,0,2,0,0,0,0,0,0,0,0,8,2,5,1,0,3,23,0,1,3,0,0,0,1,0,4,0,0,0
WVWU-TX1 West Virginia University Hospitals Inc.,,21,2,1,0,0,0,0,0,0,0,0,0,0,1,3,0,0,1,0,1,0,2,1,1,0,1,0,0,0,0,0,1,0,0,0,0,0,0,1,0,0,0,0,0,4,0,0,0,0,0,0,0,0,0,0,1,0
