,,All OPOs,ALOB-OP1 Legacy of Hope,AROR-OP1 Southern Legacy of Life,AZOB-OP1 Donor Network of Arizona,CADN-OP1 Donor Network West,CAGS-OP1 Sierra Donor Services,CAOP-OP1 OneLegacy,CASD-IO1 Lifesharing - A Donate Life Organization,CORS-OP1 Donor Alliance,FLFH-IO1 OurLegacy,FLMP-OP1 South Florida Donor Network,FLUF-IO1 LifeQuest Organ Recovery Services,FLWC-OP1 LifeLink of Florida,GALL-OP1 LifeLink of Georgia,HIOP-OP1 Legacy of Life Hawaii,IAOP-OP1 Iowa Donor Network,ILIP-OP1 Gift of Hope Organ & Tissue Donor Network,INOP-OP1 Indiana Donor Network,KYDA-OP1 Network for Hope,LAOP-OP1 Louisiana Organ Procurement Agency,MAOB-OP1 New England Organ Bank,MDPC-OP1 Infinite Legacy,MIOP-OP1 Gift of Life Michigan,MNOP-OP1 LifeSource Upper Midwest Organ Procurement Organization,MOMA-OP1 Mid-America Transplant Services,MSOP-OP1 Mississippi Organ Recovery Agency,MWOB-OP1 Midwest Transplant Network,NCCM-IO1 LifeShare Carolinas,NCNC-OP1 HonorBridge,NEOR-OP1 Live On Nebraska,NJTO-OP1 New Jersey Organ and Tissue Sharing Network OPO,NMOP-OP1 New Mexico Donor Services,NVLV-OP1 Nevada Donor Network,NYAP-OP1 Center for Donation and Transplant,NYFL-IO1 Finger Lakes Donor Recovery Network,NYRT-OP1 LiveOnNY,NYWN-OP1 Upstate New York Transplant Services Inc,OHLB-OP1 Lifebanc,OHLC-OP1 Life Connection of Ohio,OHLP-OP1 Lifeline of Ohio,OKOP-OP1 LifeShare Transplant Donor Services of Oklahoma,ORUO-IO1 Cascade Life Alliance,PADV-OP1 Gift of Life Donor Program,PATF-OP1 Center for Organ Recovery and Education,PRLL-OP1 LifeLink of Puerto Rico,SCOP-OP1 We Are Sharing Hope SC,TNDS-OP1 Tennessee Donor Services,TNMS-OP1 Mid-South Transplant Foundation,TXGC-OP1 LifeGift Organ Donation Center,TXSA-OP1 Texas Organ Sharing Alliance,TXSB-OP1 Southwest Transplant Alliance,UTOP-OP1 DonorConnect,VATB-OP1 LifeNet Health,WALC-OP1 LifeCenter Northwest,"WIDN-OP1 Versiti Blood Health, Inc.",WIUW-IO1 UW Health Organ and Tissue Donation,Non-US
All Centers,,"1,436",27,15,41,37,12,56,19,36,15,34,27,28,41,2,9,40,37,31,24,63,27,48,24,21,10,25,13,27,12,26,10,20,17,6,29,5,28,8,14,17,31,59,32,9,14,50,9,52,26,59,26,24,28,12,23,1
ALUA-TX1 University of Alabama Hospital,,13,4,0,0,0,0,0,0,0,1,1,1,0,2,0,0,1,0,0,0,0,0,0,0,0,0,0,1,0,0,0,0,0,0,0,0,0,0,0,0,0,0,0,0,0,0,1,1,0,0,0,0,0,0,0,0,0
ARUA-TX1 UAMS Medical Center,,6,0,3,0,0,0,0,0,0,0,0,0,0,0,0,0,0,0,1,0,0,0,0,0,0,0,1,0,0,0,0,0,0,0,0,0,0,0,0,0,0,0,0,0,0,0,1,0,0,0,0,0,0,0,0,0,0
AZGS-TX1 Banner-University Medical Center Phoenix,,5,0,0,3,0,0,1,0,0,0,0,0,0,0,0,0,0,0,0,0,0,0,0,0,0,0,0,0,0,0,0,0,0,0,0,0,0,0,0,0,0,0,0,0,0,0,0,0,0,0,0,0,0,1,0,0,0
AZMC-TX1 Mayo Clinic Hospital Arizona,,36,0,0,18,0,0,2,2,3,0,0,0,0,0,0,0,0,0,0,0,0,0,0,0,0,0,0,0,0,0,0,4,1,0,0,0,0,0,0,0,0,0,0,0,0,0,0,0,0,0,1,2,0,3,0,0,0
CACL-TX1 Children's Hospital Los Angeles,,3,0,0,1,0,0,2,0,0,0,0,0,0,0,0,0,0,0,0,0,0,0,0,0,0,0,0,0,0,0,0,0,0,0,0,0,0,0,0,0,0,0,0,0,0,0,0,0,0,0,0,0,0,0,0,0,0
CACS-TX1 Cedars-Sinai Medical Center,,30,0,0,6,2,1,14,3,0,0,0,0,0,0,0,0,0,0,0,0,0,0,0,0,0,0,0,0,0,0,0,0,3,0,0,0,0,0,0,0,0,1,0,0,0,0,0,0,0,0,0,0,0,0,0,0,0
CALL-TX1 Loma Linda University Medical Center,,10,0,0,0,0,0,7,1,0,0,0,0,0,0,0,0,0,0,0,0,0,0,0,0,0,0,0,0,0,0,0,0,1,0,0,0,0,0,0,0,0,0,0,0,0,0,0,0,0,0,0,1,0,0,0,0,0
CAPC-TX1 Lucile Salter Packard Children's Hospital at Stanford,,3,0,0,1,1,0,0,0,0,0,0,0,0,0,0,0,0,0,0,0,0,0,0,0,0,0,0,0,0,0,0,0,0,0,0,0,0,0,0,0,0,1,0,0,0,0,0,0,0,0,0,0,0,0,0,0,0
CAPM-TX1 California Pacific Medical Center-Van Ness Campus,,14,0,0,0,6,1,1,2,0,0,0,0,0,0,0,0,0,0,0,0,0,0,0,0,0,0,0,0,0,0,0,0,1,0,0,0,0,0,0,0,0,2,0,0,0,0,0,0,0,0,0,0,0,1,0,0,0
CASD-TX1 University of California San Diego Medical Center,,22,0,1,2,4,1,7,3,0,0,0,0,0,0,0,0,0,0,0,0,0,0,0,0,0,0,0,0,0,1,0,0,2,0,0,0,0,0,0,0,0,0,0,0,0,0,0,0,0,1,0,0,0,0,0,0,0
CASF-TX1 University of California San Francisco Medical Center,,25,0,0,0,9,2,2,3,0,0,0,0,0,0,0,0,0,0,0,0,0,0,0,0,0,0,0,0,0,0,0,0,2,0,0,0,0,0,0,0,0,7,0,0,0,0,0,0,0,0,0,0,0,0,0,0,0
CASH-TX1 Sharp Memorial Hospital,,2,0,0,0,1,0,0,1,0,0,0,0,0,0,0,0,0,0,0,0,0,0,0,0,0,0,0,0,0,0,0,0,0,0,0,0,0,0,0,0,0,0,0,0,0,0,0,0,0,0,0,0,0,0,0,0,0
CASM-TX1 University of California Davis Medical Center,,8,0,0,0,5,1,0,0,0,0,0,0,0,0,0,0,0,0,0,0,0,0,0,0,0,0,0,0,0,0,0,0,1,0,0,0,0,0,0,0,0,1,0,0,0,0,0,0,0,0,0,0,0,0,0,0,0
CASU-TX1 Stanford Health Care,,7,0,0,1,0,2,0,0,0,0,0,0,0,0,0,0,0,0,0,0,0,0,0,0,0,0,0,0,0,0,0,0,2,0,0,0,0,0,0,0,0,1,0,0,0,0,0,0,1,0,0,0,0,0,0,0,0
CAUC-TX1 University of California at Los Angeles Medical Center,,26,0,0,1,6,1,12,2,0,0,0,0,0,0,0,0,0,0,0,0,0,0,0,0,0,0,0,0,0,0,0,0,4,0,0,0,0,0,0,0,0,0,0,0,0,0,0,0,0,0,0,0,0,0,0,0,0
CAUH-TX1 Keck Hospital of USC,,16,0,0,4,2,1,4,1,0,0,0,0,0,0,0,0,0,0,0,0,0,0,0,0,0,0,0,0,0,0,0,0,2,0,0,0,0,0,0,0,0,0,0,0,0,0,0,0,0,0,0,2,0,0,0,0,0
COCH-TX1 Children's Hospital Colorado,,1,0,0,0,0,0,0,0,1,0,0,0,0,0,0,0,0,0,0,0,0,0,0,0,0,0,0,0,0,0,0,0,0,0,0,0,0,0,0,0,0,0,0,0,0,0,0,0,0,0,0,0,0,0,0,0,0
COPM-TX1 AdventHealth Porter,,8,0,0,0,0,0,0,0,7,0,0,0,0,0,0,0,0,0,0,0,0,0,0,0,0,0,0,0,0,0,0,0,0,0,0,0,0,0,0,0,0,0,0,0,0,0,0,0,0,0,0,1,0,0,0,0,0
COUC-TX1 University of Colorado Hospital/Health Science Center,,18,0,0,0,1,0,0,0,11,0,0,0,0,0,0,0,0,1,0,0,0,0,0,1,0,0,0,0,0,0,0,1,0,0,0,0,0,0,0,0,0,1,0,0,0,0,0,0,1,0,0,1,0,0,0,0,0
CTHH-TX1 Hartford Hospital,,3,0,0,0,0,0,0,0,0,0,0,0,0,0,0,0,0,1,0,0,0,0,0,0,0,0,0,0,0,0,0,0,0,0,0,0,0,0,0,1,0,0,1,0,0,0,0,0,0,0,0,0,0,0,0,0,0
CTYN-TX1 Yale New Haven Hospital,,5,0,0,0,0,0,0,0,0,0,0,0,0,0,0,0,0,0,0,0,1,0,0,0,0,0,0,0,0,0,0,0,0,0,0,1,0,0,0,0,0,0,3,0,0,0,0,0,0,0,0,0,0,0,0,0,0
DCGU-TX1 Medstar Georgetown Transplant Institute,,19,0,0,0,0,0,0,0,0,0,0,0,0,1,0,0,1,0,0,1,0,4,0,0,1,0,0,0,1,0,0,0,0,0,0,0,0,0,1,0,0,0,2,3,0,0,2,0,0,0,1,0,1,0,0,0,0
DCGW-TX1 George Washington University Hospital,,5,0,0,0,0,0,0,0,0,0,0,0,0,0,0,0,0,0,0,0,0,2,0,0,0,0,0,0,0,0,0,0,0,0,0,0,0,0,0,0,0,0,1,0,0,0,1,0,0,0,0,0,1,0,0,0,0
DCWH-TX1 Washington Hospital Center,,1,0,0,0,0,0,0,0,0,0,0,0,0,0,0,0,0,0,0,0,0,0,1,0,0,0,0,0,0,0,0,0,0,0,0,0,0,0,0,0,0,0,0,0,0,0,0,0,0,0,0,0,0,0,0,0,0
FLCC-TX1 Cleveland Clinic Florida Weston,,13,0,0,0,0,0,0,0,0,1,6,0,4,0,0,0,0,0,0,0,0,0,0,0,0,0,0,0,0,0,0,0,0,0,0,0,0,0,0,0,0,0,0,0,2,0,0,0,0,0,0,0,0,0,0,0,0
FLFH-TX1 AdventHealth Orlando,,6,1,0,0,0,0,0,0,0,2,1,0,1,1,0,0,0,0,0,0,0,0,0,0,0,0,0,0,0,0,0,0,0,0,0,0,0,0,0,0,0,0,0,0,0,0,0,0,0,0,0,0,0,0,0,0,0
FLJM-TX1 Jackson Memorial Hospital University of Miami School of Medicine,,22,1,1,1,0,0,0,0,0,2,8,3,4,0,0,0,0,0,0,0,0,0,0,0,0,0,0,0,0,0,0,0,0,0,0,0,0,0,0,0,0,0,0,0,1,0,1,0,0,0,0,0,0,0,0,0,0
FLLM-TX1 Largo Medical Center,,2,0,0,0,0,0,0,0,0,0,0,0,1,0,0,0,0,0,0,0,0,0,0,0,0,0,0,0,0,0,0,0,0,0,0,0,0,0,0,0,0,0,0,0,0,0,0,0,1,0,0,0,0,0,0,0,0
FLMR-TX1 Memorial Regional Hospital,,6,0,0,0,0,0,0,0,0,1,3,0,1,1,0,0,0,0,0,0,0,0,0,0,0,0,0,0,0,0,0,0,0,0,0,0,0,0,0,0,0,0,0,0,0,0,0,0,0,0,0,0,0,0,0,0,0
FLSL-TX1 Mayo Clinic Hospital Florida,,15,0,0,0,0,0,0,0,0,1,0,2,2,0,0,0,0,0,2,0,0,0,0,0,0,1,1,0,1,0,0,0,0,0,0,0,0,0,0,0,0,0,0,0,0,1,0,0,0,1,3,0,0,0,0,0,0
FLTG-TX1 Tampa General Hospital,,17,2,0,0,0,0,0,0,1,1,6,2,3,0,0,0,0,0,0,0,0,0,0,0,0,0,0,0,0,0,0,0,0,0,0,0,0,0,0,0,0,0,0,0,1,0,1,0,0,0,0,0,0,0,0,0,0
FLUF-TX1 UF Health Shands Hospital,,32,1,0,0,0,0,0,0,0,4,5,3,7,4,0,0,0,0,0,1,0,1,0,0,0,1,0,1,1,0,1,0,0,0,0,0,0,0,0,0,0,0,0,0,1,0,1,0,0,0,0,0,0,0,0,0,0
GAEH-TX1 Children’s Healthcare of Atlanta - Arthur M. Blank Hospital,,1,0,0,0,0,0,0,0,0,1,0,0,0,0,0,0,0,0,0,0,0,0,0,0,0,0,0,0,0,0,0,0,0,0,0,0,0,0,0,0,0,0,0,0,0,0,0,0,0,0,0,0,0,0,0,0,0
GAEM-TX1 Emory University Hospital,,19,1,0,0,0,0,0,0,0,0,1,1,2,9,0,0,1,0,0,0,1,0,0,0,0,0,0,0,0,0,0,0,0,0,0,0,0,0,0,1,0,0,0,0,0,1,1,0,0,0,0,0,0,0,0,0,0
GAPH-TX1 Piedmont Hospital,,29,1,0,0,0,0,0,0,0,0,0,3,1,6,0,0,2,3,1,3,0,0,0,0,1,1,1,0,0,0,0,0,0,0,0,0,0,0,0,0,0,0,0,0,0,0,3,0,1,1,0,0,1,0,0,0,0
HIQM-TX1 The Queen's Medical Center,,1,0,0,0,0,0,0,0,0,0,0,0,0,0,1,0,0,0,0,0,0,0,0,0,0,0,0,0,0,0,0,0,0,0,0,0,0,0,0,0,0,0,0,0,0,0,0,0,0,0,0,0,0,0,0,0,0
IAIV-TX1 University of Iowa Hospitals and Clinics Transplant Programs,,3,0,0,0,0,0,0,0,0,0,0,0,0,0,0,0,1,1,0,0,0,0,0,0,0,1,0,0,0,0,0,0,0,0,0,0,0,0,0,0,0,0,0,0,0,0,0,0,0,0,0,0,0,0,0,0,0
ILCH-TX1 Advocate Christ Medical Center,,2,0,0,0,0,0,0,0,0,0,0,0,0,0,0,0,0,0,0,0,0,0,1,0,0,0,1,0,0,0,0,0,0,0,0,0,0,0,0,0,0,0,0,0,0,0,0,0,0,0,0,0,0,0,0,0,0
ILCM-TX1 Ann & Robert H. Lurie Children's Hospital of Chicago,,3,1,0,0,0,0,0,0,0,0,0,0,0,0,0,0,0,0,0,0,0,0,1,0,0,0,0,0,0,0,0,0,0,0,0,0,0,0,0,0,0,0,0,0,0,0,0,0,0,0,0,0,0,0,1,0,0
ILLU-TX1 Loyola University Medical Center,,11,1,0,0,0,0,0,0,0,0,0,0,0,0,0,0,6,1,0,0,0,0,0,0,0,0,0,0,0,0,0,1,0,0,0,0,0,0,0,0,0,0,0,0,0,0,0,0,0,0,0,0,0,0,2,0,0
ILNM-TX1 Northwestern Memorial Hospital,,28,1,1,0,0,0,0,0,0,0,0,0,0,0,0,1,6,2,1,0,1,0,5,1,0,0,0,0,0,1,0,1,0,0,0,0,0,0,0,0,0,0,0,0,0,0,0,0,0,1,0,0,0,0,2,4,0
ILPL-TX1 Rush University Medical Center,,3,0,0,0,0,0,0,0,0,0,0,0,0,0,0,1,1,0,0,0,0,0,0,1,0,0,0,0,0,0,0,0,0,0,0,0,0,0,0,0,0,0,0,0,0,0,0,0,0,0,0,0,0,0,0,0,0
ILUC-TX1 University of Chicago Medical Center,,22,0,0,0,0,0,0,0,0,0,0,0,0,0,0,0,6,0,0,0,0,0,2,1,0,0,1,0,1,0,0,0,0,0,1,0,0,0,0,1,0,0,1,1,0,0,4,2,0,0,0,0,0,0,0,1,0
ILUI-TX1 University of Illinois Medical Center,,1,0,0,0,0,0,0,0,0,0,0,0,0,0,0,1,0,0,0,0,0,0,0,0,0,0,0,0,0,0,0,0,0,0,0,0,0,0,0,0,0,0,0,0,0,0,0,0,0,0,0,0,0,0,0,0,0
INIM-TX1 Indiana University Health,,19,0,0,0,0,0,0,0,0,0,1,0,0,2,0,0,0,4,3,0,0,0,2,1,3,1,0,0,0,0,0,0,0,0,0,0,0,0,0,0,0,0,0,0,0,0,0,0,0,0,0,0,0,0,0,1,1
INSV-TX1 Ascension St. Vincent Hospital,,5,0,0,0,0,0,0,0,0,0,0,0,0,0,0,0,1,0,0,0,0,1,1,1,0,0,0,1,0,0,0,0,0,0,0,0,0,0,0,0,0,0,0,0,0,0,0,0,0,0,0,0,0,0,0,0,0
KSUK-TX1 University of Kansas Hospital,,10,0,0,0,0,0,0,0,0,0,0,0,0,0,0,1,0,0,1,0,0,0,0,1,0,0,4,0,0,1,0,0,0,0,0,0,0,0,1,0,0,0,0,0,0,0,0,0,0,0,0,0,0,0,0,1,0
KYJH-TX1 Jewish Hospital,,1,0,0,0,0,0,0,0,0,0,0,0,0,0,0,0,0,0,1,0,0,0,0,0,0,0,0,0,0,0,0,0,0,0,0,0,0,0,0,0,0,0,0,0,0,0,0,0,0,0,0,0,0,0,0,0,0
KYUK-TX1 University of Kentucky Medical Center,,11,0,0,0,0,0,0,0,0,1,0,0,0,1,0,0,0,2,3,0,0,0,0,0,0,0,0,0,0,0,0,0,0,0,0,0,0,0,1,0,0,0,0,0,0,0,2,0,0,0,0,0,1,0,0,0,0
LAOF-TX1 Ochsner Foundation Hospital,,6,0,0,0,0,0,0,0,0,0,0,0,0,0,0,0,0,0,0,5,0,0,0,0,0,0,0,0,0,0,0,0,0,0,0,0,0,0,0,0,0,0,0,0,0,0,0,0,0,1,0,0,0,0,0,0,0
LATU-TX1 Tulane Medical Center,,1,1,0,0,0,0,0,0,0,0,0,0,0,0,0,0,0,0,0,0,0,0,0,0,0,0,0,0,0,0,0,0,0,0,0,0,0,0,0,0,0,0,0,0,0,0,0,0,0,0,0,0,0,0,0,0,0
LAWK-TX1 Willis-Knighton Medical Center,,2,0,0,0,0,0,0,0,0,0,0,0,0,1,0,0,0,0,0,1,0,0,0,0,0,0,0,0,0,0,0,0,0,0,0,0,0,0,0,0,0,0,0,0,0,0,0,0,0,0,0,0,0,0,0,0,0
MABI-TX1 Beth Israel Deaconess Medical Center,,13,0,0,0,0,0,0,0,0,0,0,1,0,0,0,0,0,0,0,0,4,0,0,0,0,0,0,0,0,0,1,0,0,0,1,3,0,1,0,0,0,0,1,1,0,0,0,0,0,0,0,0,0,0,0,0,0
MALC-TX1 Lahey Clinic Medical Center,,9,0,0,0,0,0,0,0,0,0,0,0,0,0,0,0,0,0,0,0,8,0,0,0,0,0,0,0,0,0,1,0,0,0,0,0,0,0,0,0,0,0,0,0,0,0,0,0,0,0,0,0,0,0,0,0,0
MAMG-TX1 Massachusetts General Hospital,,29,0,0,0,0,1,0,1,1,0,0,0,0,0,0,0,0,0,0,0,17,0,0,0,0,0,1,0,1,0,1,0,0,3,0,0,0,1,0,0,0,0,0,1,0,0,0,1,0,0,0,0,0,0,0,0,0
MANM-TX1 Tufts Medical Center,,14,0,0,0,0,0,0,0,0,0,0,0,0,0,0,0,0,0,0,0,4,1,0,0,0,0,0,0,0,0,0,0,0,0,0,0,1,0,0,0,0,0,6,1,0,0,0,0,0,0,0,0,1,0,0,0,0
MAPB-TX1 Brigham and Women's Hospital,,6,0,0,0,0,0,0,0,0,0,0,0,0,0,0,0,0,0,0,0,0,0,0,1,0,0,0,0,0,1,0,0,0,0,1,1,0,0,0,0,0,0,2,0,0,0,0,0,0,0,0,0,0,0,0,0,0
MAUM-TX1 UMass Memorial Medical Center,,3,0,0,0,0,0,0,0,0,0,0,0,0,0,0,0,0,0,0,0,2,0,0,0,0,0,0,0,0,0,1,0,0,0,0,0,0,0,0,0,0,0,0,0,0,0,0,0,0,0,0,0,0,0,0,0,0
MDJH-TX1 Johns Hopkins Hospital,,20,0,0,0,0,0,0,0,0,0,0,1,0,1,0,0,0,0,0,1,1,1,5,0,0,0,0,0,1,0,1,0,0,0,0,1,0,0,0,0,0,0,2,1,0,0,0,0,1,1,0,0,1,1,0,0,0
MDUM-TX1 University of Maryland Medical System,,9,0,0,0,0,0,0,0,0,0,0,0,0,1,0,0,0,0,1,0,0,3,0,0,0,0,0,0,1,0,0,0,0,0,0,0,0,0,0,0,0,0,0,0,0,0,1,0,0,0,0,0,2,0,0,0,0
MIBH-TX1 Corewell Health William Beaumont University Hospital,,8,0,0,0,0,0,0,0,0,0,0,0,0,0,0,0,0,1,0,0,1,0,3,1,0,0,0,0,0,0,0,0,0,0,0,0,0,1,0,1,0,0,0,0,0,0,0,0,0,0,0,0,0,0,0,0,0
MICH-TX1 Children's Hospital of Michigan,,1,0,0,0,0,0,0,0,0,0,0,0,0,0,0,0,0,0,0,0,0,0,0,0,0,0,0,0,0,0,0,0,0,0,0,0,0,0,0,0,0,0,0,0,0,0,1,0,0,0,0,0,0,0,0,0,0
MIHF-TX1 Henry Ford Hospital,,21,0,0,0,0,0,0,0,0,0,0,0,0,1,0,0,0,2,0,0,0,0,10,0,0,0,0,0,1,0,0,0,0,0,1,0,0,2,0,0,0,0,0,1,0,0,1,0,1,0,0,0,0,0,0,1,0
MIUM-TX1 University of Michigan Medical Center,,10,0,0,0,0,0,0,0,0,0,0,1,0,0,0,0,0,1,1,0,0,0,2,0,0,0,0,0,0,0,0,0,0,0,0,0,1,1,2,1,0,0,0,0,0,0,0,0,0,0,0,0,0,0,0,0,0
MNMC-TX1 Mayo Clinic Hospital Minnesota,,15,0,0,0,0,0,0,0,0,0,0,0,0,0,0,1,1,1,0,0,0,0,0,7,1,0,0,0,0,1,0,0,0,1,0,0,0,0,0,0,0,0,0,0,0,0,0,0,0,0,1,0,0,0,0,1,0
"MNUM-TX1 University of Minnesota Medical Center, Fairview",,14,0,0,1,0,0,0,0,0,0,0,0,0,0,0,1,0,2,0,0,0,0,0,4,1,0,1,0,0,1,0,0,0,0,0,0,0,0,0,0,0,0,0,0,0,0,0,0,0,0,0,0,0,0,0,3,0
MOBH-TX1 Barnes-Jewish Hospital,,22,1,0,0,0,0,0,0,0,0,0,0,0,1,0,0,2,1,1,0,0,0,0,0,7,0,4,1,0,0,0,0,0,0,0,0,0,0,0,0,0,0,0,0,0,0,2,0,1,0,1,0,0,0,0,0,0
MOCH-TX1 St. Louis Children's Hospital at Washington University Medical Center,,3,0,0,0,0,0,0,0,0,0,0,0,0,0,0,0,0,1,0,0,0,0,0,0,0,0,0,0,0,1,0,0,0,0,0,0,0,0,0,0,0,0,0,0,0,0,0,0,0,0,1,0,0,0,0,0,0
MOCM-TX1 Children's Mercy Hospital,,1,0,0,0,0,0,0,0,0,0,0,0,0,0,0,0,1,0,0,0,0,0,0,0,0,0,0,0,0,0,0,0,0,0,0,0,0,0,0,0,0,0,0,0,0,0,0,0,0,0,0,0,0,0,0,0,0
MOLH-TX1 St Luke's Hospital of Kansas City,,4,0,0,0,0,0,0,0,1,0,0,0,0,0,0,0,0,0,0,0,0,0,0,1,0,0,1,0,0,0,0,0,0,0,0,0,0,0,0,0,0,0,0,0,0,0,0,0,0,0,1,0,0,0,0,0,0
MOSL-TX1 SSM Health Saint Louis University Hospital,,5,1,0,0,0,0,0,0,0,0,0,0,0,0,0,0,0,1,0,0,0,0,0,1,0,0,0,0,0,0,0,0,0,0,0,0,0,0,0,0,0,0,0,0,0,0,1,0,0,0,0,0,0,0,1,0,0
MSUM-TX1 University of Mississippi Medical Center,,2,1,0,0,0,0,0,0,0,0,0,0,0,0,0,0,0,0,0,0,0,0,0,0,0,1,0,0,0,0,0,0,0,0,0,0,0,0,0,0,0,0,0,0,0,0,0,0,0,0,0,0,0,0,0,0,0
NCCM-TX1 Carolinas Medical Center,,16,0,0,0,0,0,0,0,0,0,0,0,1,0,0,0,0,1,1,1,0,0,0,0,1,1,0,2,3,0,1,0,0,0,0,0,0,1,0,0,0,0,1,0,0,0,1,0,0,0,1,0,0,0,0,0,0
NCDU-TX1 Duke University Hospital,,28,0,0,0,0,0,0,0,1,0,0,1,0,0,0,0,0,1,1,0,0,1,1,1,0,0,0,1,6,0,0,0,0,0,0,0,0,1,0,0,0,0,4,2,0,1,1,0,1,1,1,0,2,0,0,0,0
NCMH-TX1 University of North Carolina Hospitals,,8,0,0,0,0,0,0,0,0,0,0,1,0,1,0,0,0,0,1,0,0,0,0,0,0,0,0,0,0,0,0,0,0,0,0,0,0,0,0,0,0,0,0,1,0,1,0,0,0,0,0,0,2,0,1,0,0
NEUN-TX1 The Nebraska Medical Center,,14,0,1,0,0,0,0,0,3,0,0,0,0,0,0,1,2,1,0,0,0,0,0,0,0,0,0,0,0,3,1,0,0,0,0,0,0,0,0,0,0,0,0,0,0,0,0,1,0,0,0,0,0,0,1,0,0
NJBI-TX1 Newark Beth Israel Medical Center,,2,0,0,0,0,0,0,0,0,0,0,0,0,0,0,0,0,0,0,0,0,0,0,0,0,0,0,1,0,0,0,0,0,0,0,0,0,0,0,0,0,0,1,0,0,0,0,0,0,0,0,0,0,0,0,0,0
NJRW-TX1 Robert Wood Johnson University Hospital,,1,0,0,0,0,0,0,0,0,0,0,0,0,0,0,0,0,0,0,0,0,0,1,0,0,0,0,0,0,0,0,0,0,0,0,0,0,0,0,0,0,0,0,0,0,0,0,0,0,0,0,0,0,0,0,0,0
NYCP-TX1 NY Presbyterian Hospital/Columbia Univ. Medical Center,,24,0,1,0,0,0,0,0,0,0,0,0,0,0,0,0,2,0,0,0,4,5,0,0,0,0,0,1,0,0,1,0,0,2,0,1,0,1,0,1,0,0,3,0,0,0,0,0,0,0,0,0,1,0,0,1,0
"NYFL-TX1 Strong Memorial Hospital, University of Rochester Medical Center",,3,0,0,0,0,0,0,0,0,0,0,0,0,0,0,0,0,0,0,0,1,0,0,0,0,0,0,0,0,0,0,0,0,0,2,0,0,0,0,0,0,0,0,0,0,0,0,0,0,0,0,0,0,0,0,0,0
NYMA-TX1 Montefiore Medical Center,,11,0,0,0,0,0,0,0,0,0,0,1,0,0,0,0,0,0,0,0,0,0,0,0,0,0,0,0,0,0,2,0,0,0,0,1,0,1,1,0,0,0,3,0,0,1,1,0,0,0,0,0,0,0,0,0,0
NYMS-TX1 Mount Sinai Medical Center,,49,0,0,0,0,0,1,0,0,0,1,1,0,0,0,0,0,0,1,0,8,1,2,0,1,0,0,0,3,1,6,0,0,3,0,7,1,0,0,0,1,0,6,0,0,0,3,0,0,1,0,0,1,0,0,0,0
NYNS-TX1 North Shore University Hospital/Northwell Health,,12,0,0,0,0,0,0,0,0,0,0,0,0,0,0,0,0,0,0,0,2,0,0,0,0,0,0,0,0,0,0,0,0,1,0,3,0,0,0,0,0,0,2,2,0,1,0,0,0,0,0,0,0,1,0,0,0
NYNY-TX1 New York-Presbyterian Hospital/Weill Cornell Medical Center,,4,0,0,0,0,0,0,0,0,0,0,0,0,0,0,0,0,0,0,0,0,0,0,0,0,0,0,0,0,0,0,0,0,0,0,1,0,0,0,0,0,0,3,0,0,0,0,0,0,0,0,0,0,0,0,0,0
NYUC-TX1 NYU Langone Health,,23,0,0,0,0,0,0,0,0,0,0,0,0,0,0,1,0,0,1,0,0,0,0,0,0,0,0,0,2,0,2,0,0,2,0,5,0,1,0,0,0,0,5,3,0,0,0,0,0,0,1,0,0,0,0,0,0
NYWC-TX1 Westchester Medical Center,,10,0,0,0,0,0,0,0,0,0,0,0,0,0,0,0,0,0,0,0,1,1,0,0,0,0,0,0,0,0,2,0,0,2,0,1,0,0,0,0,0,0,2,0,0,0,0,0,0,0,0,0,1,0,0,0,0
OHCC-TX1 The Cleveland Clinic Foundation,,47,1,0,0,0,0,0,0,0,0,0,0,0,1,0,0,0,2,1,1,1,0,4,0,1,0,0,2,0,0,2,0,0,0,0,1,1,12,1,4,0,0,0,2,0,0,4,0,2,0,0,0,1,0,1,2,0
OHCM-TX1 Children's Hospital Medical Center,,5,1,0,0,0,0,0,0,1,0,0,0,0,0,0,0,0,0,1,0,0,0,1,0,0,0,0,0,0,0,0,0,0,0,0,0,0,0,0,0,0,0,0,0,0,0,1,0,0,0,0,0,0,0,0,0,0
OHOU-TX1 Ohio State University Medical Center,,4,0,0,0,0,0,0,0,0,0,0,0,0,0,0,0,0,1,1,0,0,0,0,0,0,0,0,0,0,0,0,0,0,0,0,0,0,0,0,0,0,0,0,0,0,0,1,1,0,0,0,0,0,0,0,0,0
OHUC-TX1 University of Cincinnati  Medical Center,,9,0,0,0,0,0,0,0,0,0,0,0,0,0,0,0,0,0,4,0,0,0,2,0,0,0,0,0,0,0,0,0,0,0,0,0,0,0,0,1,0,0,1,1,0,0,0,0,0,0,0,0,0,0,0,0,0
OHUH-TX1 University Hospitals of Cleveland,,9,0,0,0,0,0,0,0,0,0,0,0,0,0,0,0,1,0,0,0,0,0,0,0,0,0,0,0,0,0,0,0,0,0,0,0,1,2,0,2,0,0,0,3,0,0,0,0,0,0,0,0,0,0,0,0,0
OKBC-TX1 Integris Baptist Medical Center,,5,0,0,0,0,0,0,0,0,0,0,0,0,0,0,0,0,0,0,0,0,0,0,0,0,0,0,0,0,0,0,0,0,0,0,0,0,0,0,0,2,0,0,0,0,0,0,1,2,0,0,0,0,0,0,0,0
OKMD-TX1 OU Medical Center,,3,0,1,0,0,0,0,0,0,0,0,0,0,0,0,0,0,0,0,0,0,0,0,0,0,0,1,0,0,0,0,0,0,0,0,0,0,0,0,0,0,0,0,0,0,0,0,0,0,0,1,0,0,0,0,0,0
ORUO-TX1 Oregon Health and Science University,,6,0,0,0,0,0,0,0,0,0,0,0,0,0,0,0,0,0,0,0,0,0,0,0,0,0,0,0,0,0,0,0,0,0,0,0,0,0,0,0,0,4,0,0,0,0,0,0,0,0,0,0,0,2,0,0,0
PAAE-TX1 Albert Einstein Medical Center,,1,0,0,0,0,0,0,0,0,0,0,0,0,0,0,0,0,0,0,0,0,0,0,0,0,0,0,0,0,0,0,0,0,0,0,0,0,0,0,0,0,0,1,0,0,0,0,0,0,0,0,0,0,0,0,0,0
PAAG-TX1 Allegheny General Hospital,,2,0,0,0,0,0,0,0,0,0,0,0,0,0,0,0,0,0,0,0,1,0,0,0,0,0,0,0,0,0,0,0,0,0,0,0,0,0,0,0,0,0,0,0,0,0,1,0,0,0,0,0,0,0,0,0,0
PACH-TX1 UPMC Children's Hospital of Pittsburgh,,2,0,0,0,0,0,0,0,0,0,0,0,0,0,0,0,0,1,0,0,0,0,0,0,0,0,0,0,0,0,0,0,0,0,0,1,0,0,0,0,0,0,0,0,0,0,0,0,0,0,0,0,0,0,0,0,0
PACP-TX1 Children's Hospital of Philadelphia,,1,0,0,0,0,0,0,0,0,0,0,0,0,0,0,0,0,0,0,0,1,0,0,0,0,0,0,0,0,0,0,0,0,0,0,0,0,0,0,0,0,0,0,0,0,0,0,0,0,0,0,0,0,0,0,0,0
PAGM-TX1 Geisinger Medical Center,,1,0,0,0,0,0,0,0,0,0,0,0,0,0,0,0,0,0,1,0,0,0,0,0,0,0,0,0,0,0,0,0,0,0,0,0,0,0,0,0,0,0,0,0,0,0,0,0,0,0,0,0,0,0,0,0,0
PALV-TX1 Lehigh Valley Hospital,,3,0,0,0,0,0,0,0,0,0,0,0,0,0,0,0,0,0,0,0,0,0,0,0,0,0,0,0,0,0,0,0,0,1,0,1,0,0,1,0,0,0,0,0,0,0,0,0,0,0,0,0,0,0,0,0,0
PAPT-TX1 University of Pittsburgh Medical Center,,11,1,0,0,0,0,0,0,0,0,0,0,0,1,0,0,0,1,0,0,0,0,0,0,0,0,0,0,0,0,0,0,0,0,0,0,0,1,0,0,0,0,2,4,0,0,0,0,0,0,0,0,0,0,0,1,0
PATJ-TX1 Thomas Jefferson University Hospital,,3,0,0,0,0,0,0,0,0,0,0,0,0,0,0,1,0,0,0,0,0,0,0,0,0,0,0,0,0,0,0,0,0,1,0,1,0,0,0,0,0,0,0,0,0,0,0,0,0,0,0,0,0,0,0,0,0
PAUP-TX1 Hospital of the University of Pennsylvania,,11,0,0,0,0,0,0,0,0,0,0,0,0,0,0,0,0,1,1,0,2,1,0,0,0,0,0,1,0,0,2,0,0,0,0,0,0,0,0,0,0,0,3,0,0,0,0,0,0,0,0,0,0,0,0,0,0
PRSJ-TX1 Auxilio Mutuo Hospital,,3,0,0,0,0,0,0,0,0,0,0,0,0,0,0,0,0,0,0,0,0,0,0,0,0,0,0,0,0,0,0,0,0,0,0,0,0,0,0,0,0,0,0,0,3,0,0,0,0,0,0,0,0,0,0,0,0
SCMU-TX1 Medical University of South Carolina,,19,1,0,0,0,0,0,0,0,0,0,0,1,3,0,0,0,0,0,0,0,0,0,0,0,0,0,1,3,0,0,0,0,0,0,0,0,0,0,0,0,0,1,0,0,8,1,0,0,0,0,0,0,0,0,0,0
TNST-TX1 Saint Thomas Hospital,,2,0,0,0,0,0,0,0,0,0,0,0,0,0,0,0,0,0,0,0,0,0,1,0,0,0,0,0,0,0,0,0,0,0,0,0,0,0,0,0,0,0,0,0,0,0,0,0,0,1,0,0,0,0,0,0,0
TNVU-TX1 Vanderbilt University Medical Center,,30,0,2,0,0,0,0,0,2,0,0,1,0,1,0,0,2,2,0,2,0,0,1,0,2,0,0,0,2,0,1,0,0,0,0,0,0,0,0,1,0,1,1,1,0,0,6,0,0,0,0,0,0,1,0,1,0
TXAS-TX1 Baylor  Scott and White All Saints Medical Center-Fort Worth,,4,0,0,0,0,0,0,0,0,0,0,0,0,0,0,0,0,0,0,0,0,0,0,0,0,0,0,0,0,0,0,1,0,0,0,0,0,0,0,0,2,0,0,0,0,0,0,0,0,0,1,0,0,0,0,0,0
"TXBC-TX1 University Hospital, University of Texas Health Science Center",,8,0,0,0,0,0,0,0,0,0,0,0,0,0,0,0,0,0,0,0,0,0,0,0,0,0,0,0,0,0,0,0,0,0,0,0,0,0,0,0,3,0,0,0,0,0,0,0,0,4,1,0,0,0,0,0,0
TXCM-TX1 Children's Medical Center of Dallas,,1,0,1,0,0,0,0,0,0,0,0,0,0,0,0,0,0,0,0,0,0,0,0,0,0,0,0,0,0,0,0,0,0,0,0,0,0,0,0,0,0,0,0,0,0,0,0,0,0,0,0,0,0,0,0,0,0
TXHD-TX1 Medical City Dallas Hospital,,5,0,0,0,0,0,0,0,0,0,0,0,0,0,0,0,0,0,0,0,0,0,0,0,0,1,0,0,0,0,0,0,0,0,0,0,0,0,0,0,1,0,0,0,0,0,0,0,3,0,0,0,0,0,0,0,0
TXHI-TX1 CHI St. Luke's Health Baylor College of Medicine Medical Center,,14,2,0,0,0,0,0,0,0,0,1,1,0,0,0,0,0,0,0,0,0,0,0,0,0,1,1,0,0,0,0,0,0,0,0,0,0,0,0,0,0,0,0,0,0,0,0,0,6,0,2,0,0,0,0,0,0
TXHS-TX1 Methodist Specialty and Transplant Hospital,,10,0,0,0,0,0,0,0,0,0,0,0,0,0,0,0,0,0,0,0,0,0,0,0,0,0,2,0,0,0,0,0,0,0,0,0,0,0,0,0,0,0,0,0,0,0,0,0,1,5,2,0,0,0,0,0,0
TXMC-TX1 Methodist Dallas Medical Center,,9,0,0,0,0,0,0,0,0,0,0,0,0,0,0,0,0,0,0,0,0,0,0,0,1,1,0,0,0,0,0,0,0,0,0,0,0,0,0,0,0,0,0,0,0,0,0,0,1,0,6,0,0,0,0,0,0
TXMH-TX1 Houston Methodist Hospital,,62,2,3,1,0,0,0,0,0,0,0,1,0,0,0,0,0,0,0,7,1,0,0,0,1,0,2,0,0,1,0,0,0,0,0,0,0,0,0,0,5,0,0,2,0,0,1,1,17,6,11,0,0,0,0,0,0
TXSP-TX1 UT Southwestern Medical Center/William P. Clements Jr. University Hospital,,32,1,0,0,0,0,0,0,0,0,0,0,0,0,0,0,0,0,0,0,0,0,0,0,0,0,3,0,0,0,0,0,0,0,0,0,0,0,0,0,2,0,0,0,0,0,0,0,9,1,16,0,0,0,0,0,0
TXSW-TX1 Scott and White Memorial Hospital,,3,0,0,0,0,0,0,0,0,0,0,0,0,0,0,0,0,0,0,0,0,0,0,0,0,0,0,0,0,0,0,0,0,0,0,0,0,0,0,0,0,0,0,0,0,0,0,0,0,1,2,0,0,0,0,0,0
TXTC-TX1 Texas Children's Hospital,,4,0,0,0,0,0,0,0,0,0,0,0,0,0,0,0,0,0,0,0,0,0,0,0,0,0,0,0,0,0,0,0,0,0,0,0,0,1,0,0,1,0,0,0,0,0,0,0,1,0,1,0,0,0,0,0,0
TXTX-TX1 Baylor University Medical Center,,4,0,0,0,0,0,0,0,0,0,0,0,0,0,0,0,0,0,0,0,0,0,0,0,0,0,0,0,0,0,0,0,0,0,0,0,0,0,0,0,0,0,0,0,0,0,0,0,2,0,2,0,0,0,0,0,0
TXVA-TX1 Michael E. DeBakey VA Medical Center,,4,0,0,0,0,0,0,0,0,0,0,0,0,0,0,0,0,0,0,1,0,0,0,0,0,0,0,0,0,0,0,0,0,0,0,0,0,0,0,0,0,0,0,0,0,0,0,1,0,0,2,0,0,0,0,0,0
UTLD-TX1 Intermountain Medical Center,,28,0,0,0,0,1,2,0,3,0,0,0,0,0,1,0,0,0,0,0,0,0,0,0,0,0,0,0,0,0,0,2,0,0,0,0,0,0,0,0,0,4,0,0,0,0,0,0,0,0,0,13,0,2,0,0,0
UTMC-TX1 University of Utah Medical Center,,11,0,0,1,0,0,1,0,1,0,0,0,0,0,0,0,0,0,0,0,0,0,1,0,0,0,0,0,0,0,0,0,1,0,0,0,0,0,0,0,0,0,0,0,0,0,0,0,0,0,0,6,0,0,0,0,0
VAFH-TX1 Inova Fairfax Hospital,,4,0,0,0,0,0,0,0,0,0,0,0,0,0,0,0,0,0,0,0,0,1,0,0,0,0,0,0,0,0,0,0,0,0,0,0,0,0,0,0,0,0,0,1,0,0,1,0,0,0,0,0,1,0,0,0,0
"VAMC-TX1 VCU Health System Authority, VCUMC",,15,0,0,0,0,0,0,0,0,0,0,1,0,0,0,0,0,0,0,0,0,3,1,0,0,0,0,0,0,0,0,0,0,1,0,0,0,1,0,0,0,0,0,1,0,0,1,0,0,0,0,0,6,0,0,0,0
VANG-TX1 Sentara Norfolk General Hospital,,1,0,0,0,0,0,0,0,0,0,0,0,0,1,0,0,0,0,0,0,0,0,0,0,0,0,0,0,0,0,0,0,0,0,0,0,0,0,0,0,0,0,0,0,0,0,0,0,0,0,0,0,0,0,0,0,0
VAUV-TX1 University of Virginia Health Sciences Center,,6,0,0,0,0,0,0,0,0,0,0,1,0,1,0,0,0,0,0,0,0,1,0,0,0,0,0,0,0,0,0,0,0,0,0,0,0,0,0,0,0,0,1,0,1,0,0,0,0,0,0,0,1,0,0,0,0
WASH-TX1 Providence Sacred Heart Medical Center & Children's Hospital,,1,0,0,0,0,0,0,0,0,0,0,0,0,0,0,0,0,0,0,0,0,0,0,0,0,0,0,0,0,0,0,0,0,0,0,0,0,0,0,0,0,0,0,0,0,0,0,0,0,0,0,0,0,1,0,0,0
WASM-TX1 Swedish Medical Center,,10,0,0,0,0,0,0,0,0,0,0,0,0,0,0,0,0,0,0,0,0,0,0,0,0,0,0,0,0,0,0,0,0,0,0,0,0,0,0,0,0,2,0,0,0,0,0,0,0,0,0,0,0,8,0,0,0
WAUW-TX1 University of Washington Medical Center,,13,0,0,0,0,0,0,0,0,0,0,0,0,0,0,0,0,0,0,0,0,0,0,0,0,0,0,0,0,0,0,0,0,0,0,0,0,0,0,0,0,6,0,0,0,0,0,0,0,0,0,0,0,7,0,0,0
WISE-TX1 Froedtert Memorial Lutheran Hospital,,5,0,0,0,0,0,0,0,0,0,0,0,0,0,0,0,1,0,0,0,0,0,0,0,0,0,0,0,0,0,0,0,0,0,0,0,0,0,0,0,0,0,0,0,0,0,2,0,0,0,0,0,0,0,1,1,0
WISL-TX1 Aurora St. Luke's Medical Center,,1,0,0,0,0,0,0,0,0,0,0,0,0,0,0,0,0,0,0,0,0,0,0,0,0,0,0,0,0,0,0,0,0,0,0,0,0,0,0,0,0,0,0,0,0,0,0,0,0,0,0,0,0,0,0,1,0
WIUW-TX1 University of Wisconsin Hospital and Clinics,,12,0,0,0,0,0,0,0,0,0,0,0,0,0,0,0,2,1,1,0,0,0,0,1,0,0,0,0,0,0,0,0,0,0,0,0,0,0,0,0,0,0,0,0,0,0,1,0,0,0,0,0,0,0,2,4,0
WVWU-TX1 West Virginia University Hospitals Inc.,,1,0,0,0,0,0,0,0,0,0,0,0,0,0,0,0,0,0,0,0,1,0,0,0,0,0,0,0,0,0,0,0,0,0,0,0,0,0,0,0,0,0,0,0,0,0,0,0,0,0,0,0,0,0,0,0,0
