id,type,name,state,region,total_inflow,total_outflow,total_flow,edge_count,lat,lon,coordinate_status,geocode_priority,geocode_query,notes
TXSP-TX1,transplant_center,UT Southwestern Medical Center/William P. Clements Jr. University Hospital,Texas,Region  4,409,0,409,40,31.0545,-97.5635,manual_verified,9,"UT Southwestern Medical Center/William P. Clements Jr. University Hospital, Texas (transplant center hospital)",manual_map;high
ALUA-TX1,transplant_center,University of Alabama Hospital,Alabama,Region  3,401,0,401,39,32.8067,-86.7911,manual_verified,9,"University of Alabama Hospital, Alabama (transplant center hospital)",manual_map;high
TXTX-TX1,transplant_center,Baylor University Medical Center,Texas,Region  4,400,0,400,41,31.0545,-97.5635,manual_verified,9,"Baylor University Medical Center, Texas (transplant center hospital)",manual_map;high
MNUM-TX1,transplant_center,"University of Minnesota Medical Center, Fairview",Minnesota,Region  7,397,0,397,42,45.6945,-93.9002,manual_verified,9,"University of Minnesota Medical Center, Fairview, Minnesota (transplant center hospital)",manual_map;high
WAUW-TX1,transplant_center,University of Washington Medical Center,Washington,Region  6,395,0,395,17,47.4009,-121.4905,manual_verified,9,"University of Washington Medical Center, Washington (transplant center hospital)",manual_map;high
TXHI-TX1,transplant_center,CHI St. Luke's Health Baylor College of Medicine Medical Center,Texas,Region  4,374,0,374,39,31.0545,-97.5635,manual_verified,9,"CHI St. Luke's Health Baylor College of Medicine Medical Center, Texas (transplant center hospital)",manual_map;high
NEUN-TX1,transplant_center,The Nebraska Medical Center,Nebraska,Region  8,353,0,353,28,41.1254,-98.2681,manual_verified,9,"The Nebraska Medical Center, Nebraska (transplant center hospital)",manual_map;high
ILUC-TX1,transplant_center,University of Chicago Medical Center,Illinois,Region  7,344,0,344,38,40.3495,-88.9861,manual_verified,9,"University of Chicago Medical Center, Illinois (transplant center hospital)",manual_map;high
LAOF-TX1,transplant_center,Ochsner Foundation Hospital,Louisiana,Region  3,329,0,329,32,31.1695,-91.8678,manual_verified,9,"Ochsner Foundation Hospital, Louisiana (transplant center hospital)",manual_map;high
NEOR-OP1,source_dsa,Live On Nebraska,Nebraska,Region  8,0,327,327,71,41.1254,-98.2681,manual_verified,9,"Live On Nebraska, Nebraska (organ procurement)",manual_map;high
MIHF-TX1,transplant_center,Henry Ford Hospital,Michigan,Region  10,325,0,325,36,43.3266,-84.5361,manual_verified,9,"Henry Ford Hospital, Michigan (transplant center hospital)",manual_map;high
CALL-TX1,transplant_center,Loma Linda University Medical Center,California,Region  5,324,0,324,21,36.1162,-119.6816,manual_verified,9,"Loma Linda University Medical Center, California (transplant center hospital)",manual_map;high
CAUH-TX1,transplant_center,Keck Hospital of USC,California,Region  5,322,0,322,13,36.1162,-119.6816,manual_verified,9,"Keck Hospital of USC, California (transplant center hospital)",manual_map;high
TXHS-TX1,transplant_center,Methodist Specialty and Transplant Hospital,Texas,Region  4,321,0,321,33,31.0545,-97.5635,manual_verified,9,"Methodist Specialty and Transplant Hospital, Texas (transplant center hospital)",manual_map;high
CAPM-TX1,transplant_center,California Pacific Medical Center-Van Ness Campus,California,Region  5,312,0,312,14,36.1162,-119.6816,manual_verified,9,"California Pacific Medical Center-Van Ness Campus, California (transplant center hospital)",manual_map;high
UTMC-TX1,transplant_center,University of Utah Medical Center,Utah,Region  5,257,0,257,26,40.1500,-111.8624,manual_verified,9,"University of Utah Medical Center, Utah (transplant center hospital)",manual_map;high
CASM-TX1,transplant_center,University of California Davis Medical Center,California,Region  5,253,0,253,24,36.1162,-119.6816,manual_verified,9,"University of California Davis Medical Center, California (transplant center hospital)",manual_map;high
KSUK-TX1,transplant_center,University of Kansas Hospital,Kansas,Region  8,238,0,238,29,38.5266,-96.7265,manual_verified,9,"University of Kansas Hospital, Kansas (transplant center hospital)",manual_map;high
WASM-TX1,transplant_center,Swedish Medical Center,Washington,Region  6,216,0,216,8,47.4009,-121.4905,manual_verified,9,"Swedish Medical Center, Washington (transplant center hospital)",manual_map;high
ORUO-TX1,transplant_center,Oregon Health and Science University,Oregon,Region  6,214,0,214,15,44.5720,-122.0709,manual_verified,9,"Oregon Health and Science University, Oregon (transplant center hospital)",manual_map;high
CAIM-TX1,transplant_center,University of California Irvine Medical Center,California,Region  5,210,0,210,19,36.1162,-119.6816,manual_verified,9,"University of California Irvine Medical Center, California (transplant center hospital)",manual_map;high
HIOP-OP1,source_dsa,Legacy of Life Hawaii,Hawaii,Region  6,0,166,166,30,21.0943,-157.4983,manual_verified,9,"Legacy of Life Hawaii, Hawaii (organ procurement)",manual_map;high
HIQM-TX1,transplant_center,The Queen's Medical Center,Hawaii,Region  6,112,0,112,2,21.0943,-157.4983,manual_verified,9,"The Queen's Medical Center, Hawaii (transplant center hospital)",manual_map;high
